{
  "schema": "dubyeol2.external_audit.result.v0",
  "verdict": "PASS",
  "summary_for_owner": "예치금 충전 요청 -> 운영자 승인/거절 -> 잔액/원장 반영 흐름을 코드로 직접 확인했습니다. 승인 전 잔액 미반영, 같은 요청 중복 승인 차단, 거절 시 잔액 미반영, 셀러 간 데이터 격리, 관리자 권한 가드가 모두 실제 코드(prisma 트랜잭션, updateMany 조건부 갱신, /admin 레이아웃 가드)로 구현되어 있고 96개 테스트와 빌드가 통과했습니다. 실계좌·PG·은행 API·자동입금·패킹리스트 등 금지 항목은 코드 어디에도 없고 화면에는 '오픈 전 확정' 안내 문구만 있습니다. Phase 10 고객 약속을 그대로 지켰습니다.",
  "findings": [
    {
      "severity": "MINOR",
      "description": "listAdminWalletTopUps()는 함수 자체에 관리자 권한 검사가 없고, 현재는 /admin 레이아웃(src/app/admin/layout.tsx)의 세션 가드에만 의존해 보호된다.",
      "evidence": "src/lib/wallet-topups.ts의 listAdminWalletTopUps는 role 검사 없이 전체 셀러의 충전 요청과 이메일/연락처를 반환한다. 현재 이 함수를 호출하는 곳은 src/app/admin/wallet-topups/page.tsx 하나뿐이며, 이는 layout에서 getSessionUser().role !== 'ADMIN' 이면 redirect 한다.",
      "customer_harm": "현재 시점에는 고객 피해 없음 — 유일한 호출부가 관리자 레이아웃으로 보호됨. 다만 향후 이 함수를 다른 API route나 서버 액션에서 호출할 경우, 그 지점에 별도 관리자 검사를 빠뜨리면 셀러 이메일·연락처·충전 내역이 노출될 수 있는 구조적 위험이다.",
      "recheck_criteria": "listAdminWalletTopUps 또는 승인/거절 lib 함수처럼 함수 내부에서 assertAdminRole을 호출하도록 방어선을 한 겹 추가하거나, 새로 이 함수를 호출하는 지점이 생길 때마다 관리자 가드가 함께 있는지 확인한다."
    }
  ],
  "question_for_pm_to_ask_owner": ""
}
