{
  "schema": "dubyeol2.external_audit.result.v0",
  "verdict": "PASS",
  "summary_for_owner": "Phase 9(상품/SKU 라인 작업·정산 기초)를 코드·테스트·실제 QA 증거와 대조했고 PASS입니다. SKU별 입고·부족·하자·검수·견적이 주문 전체 한 줄로 뭉치지 않고 SKU 단위로 저장·표시되고, 다른 셀러의 SKU 데이터가 섞이지 않도록 sellerId 스코프가 주문 조회·출고요청 경로 전체에 적용되어 있으며 이는 자동 테스트로 확인됩니다(다른 셀러 주문 출고 요청 시 거부, SKU 상품가 합계가 총수량으로 나누어떨어지지 않는 경우에도 SKU 근거 정확 합계로 차감). 포장단위·패킹리스트는 Phase 9 화면에 등장하지 않고 '포장단위는 출고요청 때 배정됩니다' 안내 문구로만 존재해 Phase 11로 올바르게 미뤄져 있고, 실계좌·실입금·실결제·실송장·1688 연동은 코드에 없습니다. 전체 테스트(vitest 6개 파일 80개) 재실행, 빌드 재실행, git diff --check 재확인으로 기계검증 결과를 직접 재현했습니다. Codex 환경에 /security-review 도구가 없어 대체된 보안 점검 항목은 admin API 라우트 인증 가드, DB 스키마·마이그레이션(추가만, 파괴적 변경 없음), 예치금 적립 함수의 공개 라우트 미노출 여부를 직접 재확인해 문제를 찾지 못했습니다.",
  "findings": [],
  "question_for_pm_to_ask_owner": "없음 — 이번 Phase는 대표님 판단이 필요한 열린 질문이 없습니다."
}
