{"schema":"dubyeol2.external_audit.result.v0","verdict":"PASS","summary_for_owner":"PASS. 1차 감리의 요율 라벨 하드코딩 문제는 `RATES` 파생으로 해소됐고, 항목별 견적 금액·합계·면책 문구·검수비 미신청 처리·권한/셀러 격리 기준이 고객 약속과 맞습니다. read-only 환경이라 Vitest 재실행은 막혔지만, 타입 검사는 통과했고 코드·스냅샷·기계검증 증거가 PASS 주장을 뒷받침합니다. 완료 전 `current-run.md`와 `03-verification.md`의 오래된 상태 문구는 정리하는 것이 좋습니다.","findings":[],"question_for_pm_to_ask_owner":""}