{
  "schema": "dubyeol2.external_audit.result.v0",
  "verdict": "PASS",
  "summary_for_owner": "Phase 11 포장단위 기능을 코드·테스트·빌드로 대조 확인했습니다. 박스별 SKU 수량은 출고 가능 수량을 넘지 못하게 트랜잭션으로 막혀 있고, 셀러 A/B 데이터는 sellerId 스코프로 격리되며, 운영자 저장 API는 ADMIN 세션만 허용합니다. 셀러 화면과 운영자 화면 모두 같은 DB 값을 그대로 표시하고, 정식 PDF 패킹리스트·실제 송장·배송조회·세관/택배사 API는 코드 어디에도 연결되어 있지 않고 '아직 연결하지 않았습니다' 안내만 표시됩니다. vitest 47개(shipment-packages/wallet/orders) 및 전체 113개 테스트, npm run build, git diff --check를 직접 재실행해 03-verification.md의 기계검증 결과와 일치함을 확인했습니다.",
  "findings": [],
  "question_for_pm_to_ask_owner": ""
}
